{
  "atom_id": "tp:lane4/axioms/ax-part1-ax-scaffold-d9-1",
  "atom_uid": "sha256:49b381d0b71e9b630bc88f8e798e8edcdb5796950f6e31cb2ad9798babfc187f",
  "title": "D9.1 — Grace Operator Definition",
  "claim": "D9.1 — Grace Operator Definition is classified in Part 1 as AX_SCAFFOLD with decision KEEP and anchor BC6 (Infinite Energy Source).",
  "domain": "axioms",
  "lane": "Classification",
  "claim_class": "classification",
  "mode_classification": "AX_SCAFFOLD",
  "assumptions": [
    "BC6 (Infinite Energy Source)"
  ],
  "definitions": [],
  "equations": [],
  "bridges": [],
  "dependencies": [
    "BC6 (Infinite Energy Source)"
  ],
  "negative_guards": [
    "Mode classification is not proof.",
    "Do not encode every Part 1 row as a Lean axiom.",
    "Lean status must be checked separately from registry status."
  ],
  "kill_conditions": [
    "A later canonical dashboard contradicts this mode classification.",
    "A clean dependency audit changes the anchor status."
  ],
  "proof_label": "NOT_ESTABLISHED",
  "current_status": "active_candidate",
  "rerun_status": "not_applicable",
  "source_artifacts": [
    "O:\\_Theophysics_v5\\00_AXIOMS\\_LOSSLESS_SUMMARY\\AXIOMS_PART1_MODE_CLASSIFICATION.md"
  ],
  "ledger": [
    {
      "event_type": "classification_imported",
      "lane": "Classification",
      "result": "recorded",
      "artifact_path": "O:\\_Theophysics_v5\\00_AXIOMS\\_LOSSLESS_SUMMARY\\AXIOMS_PART1_MODE_CLASSIFICATION.md",
      "meaning": "Imported Part 1 mode classification row D9.1 as AX_SCAFFOLD.",
      "limits": "Classification import is not proof and does not promote the claim to canon.",
      "reviewer": "Codex",
      "timestamp": "2026-07-28T19:10:19+00:00",
      "event_id": "sha256:b84e7c524fa64ac7093dbbafc1575c3b9763474877a0be7c2a28d7fad46bedd3"
    }
  ],
  "source_claim_id": "AX_PART1:AX_SCAFFOLD:D9.1"
}
