{
  "atom_id": "tp:lane4/axioms/ax-part1-fw-extended-a12-2",
  "atom_uid": "sha256:c86267363c9beaff8c625e785674a9c6ee61712e4f20c84f36004695a067fffe",
  "title": "A12.2 — Bimodal Outcome",
  "claim": "A12.2 — Bimodal Outcome is classified in Part 1 as FW_EXTENDED with decision MOVE_OUT_OF_STRICT_CORE and anchor BC6 (Infinite Energy Source).",
  "domain": "axioms",
  "lane": "Classification",
  "claim_class": "classification",
  "mode_classification": "FW_EXTENDED",
  "assumptions": [
    "BC6 (Infinite Energy Source)"
  ],
  "definitions": [],
  "equations": [],
  "bridges": [],
  "dependencies": [
    "BC6 (Infinite Energy Source)"
  ],
  "negative_guards": [
    "Mode classification is not proof.",
    "Do not encode every Part 1 row as a Lean axiom.",
    "Lean status must be checked separately from registry status."
  ],
  "kill_conditions": [
    "A later canonical dashboard contradicts this mode classification.",
    "A clean dependency audit changes the anchor status."
  ],
  "proof_label": "NOT_ESTABLISHED",
  "current_status": "active_candidate",
  "rerun_status": "not_applicable",
  "source_artifacts": [
    "O:\\_Theophysics_v5\\00_AXIOMS\\_LOSSLESS_SUMMARY\\AXIOMS_PART1_MODE_CLASSIFICATION.md"
  ],
  "ledger": [
    {
      "event_type": "classification_imported",
      "lane": "Classification",
      "result": "recorded",
      "artifact_path": "O:\\_Theophysics_v5\\00_AXIOMS\\_LOSSLESS_SUMMARY\\AXIOMS_PART1_MODE_CLASSIFICATION.md",
      "meaning": "Imported Part 1 mode classification row A12.2 as FW_EXTENDED.",
      "limits": "Classification import is not proof and does not promote the claim to canon.",
      "reviewer": "Codex",
      "timestamp": "2026-07-28T19:10:19+00:00",
      "event_id": "sha256:4d54b5f74208db4a657035e86953af67e7a4b5870a9aa50f37947de79a2ce66c"
    }
  ],
  "source_claim_id": "AX_PART1:FW_EXTENDED:A12.2"
}
