{
  "atom_id": "tp:lane4/axioms/ax-part1-fw-extended-t17-1",
  "atom_uid": "sha256:3dc207407060f541e090c44dbe2b3d14e957cbbd7a4155af26299a2136e5303a",
  "title": "T17.1 — AI Can Achieve Consciousness",
  "claim": "T17.1 — AI Can Achieve Consciousness is classified in Part 1 as FW_EXTENDED with decision MOVE_OUT_OF_STRICT_CORE and anchor UNANCHORED_IN_CURRENT_CHAIN.",
  "domain": "axioms",
  "lane": "Classification",
  "claim_class": "classification",
  "mode_classification": "FW_EXTENDED",
  "assumptions": [
    "UNANCHORED_IN_CURRENT_CHAIN"
  ],
  "definitions": [],
  "equations": [],
  "bridges": [],
  "dependencies": [
    "UNANCHORED_IN_CURRENT_CHAIN"
  ],
  "negative_guards": [
    "Mode classification is not proof.",
    "Do not encode every Part 1 row as a Lean axiom.",
    "Lean status must be checked separately from registry status.",
    "Unanchored entry cannot be treated as bedrock until a clean dependency path is supplied."
  ],
  "kill_conditions": [
    "A later canonical dashboard contradicts this mode classification.",
    "A clean dependency audit changes the anchor status."
  ],
  "proof_label": "NOT_ESTABLISHED",
  "current_status": "active_candidate_unanchored",
  "rerun_status": "not_applicable",
  "source_artifacts": [
    "O:\\_Theophysics_v5\\00_AXIOMS\\_LOSSLESS_SUMMARY\\AXIOMS_PART1_MODE_CLASSIFICATION.md"
  ],
  "ledger": [
    {
      "event_type": "classification_imported",
      "lane": "Classification",
      "result": "recorded",
      "artifact_path": "O:\\_Theophysics_v5\\00_AXIOMS\\_LOSSLESS_SUMMARY\\AXIOMS_PART1_MODE_CLASSIFICATION.md",
      "meaning": "Imported Part 1 mode classification row T17.1 as FW_EXTENDED.",
      "limits": "Classification import is not proof and does not promote the claim to canon.",
      "reviewer": "Codex",
      "timestamp": "2026-07-28T19:10:19+00:00",
      "event_id": "sha256:4ef09cc8a849f8e8d49c8a98d23e009b4bd74c4e4068985af95c82ccdaa80cda"
    }
  ],
  "source_claim_id": "AX_PART1:FW_EXTENDED:T17.1"
}
