{
  "atom_id": "tp:lane4/isomorphic-events/iso-iso-036",
  "atom_uid": "sha256:7ddba1598f2b56dfbf1edbbd3564536ac8d7dde980f2354f96874d8e8e627e6a",
  "title": "ISO-036 - Fluid Dynamics ↔ Pneumatology",
  "claim": "ISO-036: Fluid Dynamics ↔ Pneumatology maps Fluid Dynamics (Navier-Stokes) to Pneumatology (Holy Spirit). Workbook verdict: Level 2. Honest verdict: UPGRADED from L1. Re, Bernoulli, boundary layers map. Qualitative.",
  "domain": "isomorphic-events",
  "lane": "IsomorphicEvents",
  "claim_class": "isomorphic_event",
  "mode_classification": "C2_PARTIAL_CORRESPONDENCE",
  "assumptions": [
    "Fluid Dynamics (Navier-Stokes)",
    "Pneumatology (Holy Spirit)",
    "AAA classification workbook accepted as source classification, not proof"
  ],
  "definitions": [
    "↑ UPGRADED. Re threshold, Bernoulli, viscosity/institutionalism. 35k doc.",
    "UPGRADED from L1. Re, Bernoulli, boundary layers map. Qualitative."
  ],
  "equations": [],
  "bridges": [
    "Fluid Dynamics (Navier-Stokes) -> Pneumatology (Holy Spirit)"
  ],
  "dependencies": [
    "ISO-036"
  ],
  "negative_guards": [
    "Workbook ISO level is not automatic canon promotion.",
    "Do not label as C5 formal isomorphism without explicit preservation proof.",
    "Do not use as Lean proof unless the cited Lean file and theorem compile in the current package context.",
    "Weakest link: Mappings qualitative not quantitative; Re_crit unmeasured",
    "Promotion blocker: Etymology ≠ structure. Shared word origins don't create structural mappings",
    "Promotion blocker: Laminar/turbulent distinction is metaphorical, not constraining",
    "Promotion blocker: Navier-Stokes don't constrain pneumatology"
  ],
  "kill_conditions": [
    "Mapping fails structural-preservation review.",
    "A rival explanation preserves the same features with fewer assumptions.",
    "A claimed Lean theorem cannot be located or compiled in current context.",
    "Weakest link remains unresolved: Mappings qualitative not quantitative; Re_crit unmeasured"
  ],
  "proof_label": "ISOMORPHIC_EVENT_CANDIDATE",
  "current_status": "active_candidate",
  "rerun_status": "not_applicable",
  "source_artifacts": [
    "\\\\192.168.2.50\\h_hp\\Desktop\\Master EXCEL\\Isomorphic_Updated.xlsx",
    "D:\\GitHub\\Faith-through-physics-atoms\\_runtime\\Isomorphic_Updated.source-copy.xlsx"
  ],
  "ledger": [
    {
      "event_type": "isomorphic_workbook_imported",
      "lane": "IsomorphicEvents",
      "result": "recorded",
      "artifact_path": "\\\\192.168.2.50\\h_hp\\Desktop\\Master EXCEL\\Isomorphic_Updated.xlsx",
      "meaning": "Imported ISO-036 from Isomorphic_Updated.xlsx as an isomorphic-event candidate.",
      "limits": "Workbook level is preserved as source classification, not automatic formal isomorphism or canon proof.",
      "reviewer": "Codex",
      "timestamp": "2026-07-28T19:21:29+00:00",
      "event_id": "sha256:6a7722f16da371d57a1f99c435fd11c7ccf243aa697a8db39506d2e8678627df"
    }
  ],
  "source_claim_id": "ISO:ISO-036"
}
