{
  "atom_id": "tp:lane4/isomorphic-events/iso-iso-024",
  "atom_uid": "sha256:d44871ed843cc8c30f612b548a5c14379df9a2d4f2b1c27ccb0e339b476b0632",
  "title": "ISO-024 - Worldview Uniqueness (8-BC)",
  "claim": "ISO-024: Worldview Uniqueness (8-BC) maps Constraint Satisfaction to Christian Uniqueness. Workbook verdict: Level 1.5 (⚠️ circ.). Honest verdict: Very Low confidence. Overlaps ISO-019.",
  "domain": "isomorphic-events",
  "lane": "IsomorphicEvents",
  "claim_class": "isomorphic_event",
  "mode_classification": "C0_ANALOGY",
  "assumptions": [
    "Constraint Satisfaction",
    "Christian Uniqueness",
    "AAA classification workbook accepted as source classification, not proof"
  ],
  "definitions": [
    "Truth table clear. Falsifiable: find BC9.",
    "Very Low confidence. Overlaps ISO-019."
  ],
  "equations": [],
  "bridges": [
    "Constraint Satisfaction -> Christian Uniqueness"
  ],
  "dependencies": [
    "ISO-024"
  ],
  "negative_guards": [
    "Workbook ISO level is not automatic canon promotion.",
    "Do not label as C5 formal isomorphism without explicit preservation proof.",
    "Do not use as Lean proof unless the cited Lean file and theorem compile in the current package context.",
    "Weakest link: ⚠️ Extreme bias risk. Overlaps ISO-019."
  ],
  "kill_conditions": [
    "Mapping fails structural-preservation review.",
    "A rival explanation preserves the same features with fewer assumptions.",
    "A claimed Lean theorem cannot be located or compiled in current context.",
    "Test B: Non-Arbitrariness fails in source evaluation.",
    "Test D: Bidirectional fails in source evaluation.",
    "Weakest link remains unresolved: ⚠️ Extreme bias risk. Overlaps ISO-019."
  ],
  "proof_label": "ISOMORPHIC_EVENT_CANDIDATE",
  "current_status": "active_candidate",
  "rerun_status": "not_applicable",
  "source_artifacts": [
    "\\\\192.168.2.50\\h_hp\\Desktop\\Master EXCEL\\Isomorphic_Updated.xlsx",
    "D:\\GitHub\\Faith-through-physics-atoms\\_runtime\\Isomorphic_Updated.source-copy.xlsx"
  ],
  "ledger": [
    {
      "event_type": "isomorphic_workbook_imported",
      "lane": "IsomorphicEvents",
      "result": "recorded",
      "artifact_path": "\\\\192.168.2.50\\h_hp\\Desktop\\Master EXCEL\\Isomorphic_Updated.xlsx",
      "meaning": "Imported ISO-024 from Isomorphic_Updated.xlsx as an isomorphic-event candidate.",
      "limits": "Workbook level is preserved as source classification, not automatic formal isomorphism or canon proof.",
      "reviewer": "Codex",
      "timestamp": "2026-07-28T19:21:29+00:00",
      "event_id": "sha256:3ecc808ff8245f903c05c2f0981b09ca767e2a2e5e843202b23df9d2e6258f4e"
    }
  ],
  "source_claim_id": "ISO:ISO-024"
}
