{
  "atom_id": "tp:lane4/isomorphic-events/iso-iso-008",
  "atom_uid": "sha256:951de4ad2bbf529194966dcf9c67eea38255f1f3003d2178019411de415d4580",
  "title": "ISO-008 - General Relativity ↔ Grace",
  "claim": "ISO-008: General Relativity ↔ Grace maps General Relativity to Grace (Soteriology). Workbook verdict: Level 2. Honest verdict: Elegant metaphor. Doesn't constrain enough.",
  "domain": "isomorphic-events",
  "lane": "IsomorphicEvents",
  "claim_class": "isomorphic_event",
  "mode_classification": "C2_PARTIAL_CORRESPONDENCE",
  "assumptions": [
    "General Relativity",
    "Grace (Soteriology)",
    "AAA classification workbook accepted as source classification, not proof"
  ],
  "definitions": [
    "Geometric framework rich",
    "Elegant metaphor. Doesn't constrain enough."
  ],
  "equations": [],
  "bridges": [
    "General Relativity -> Grace (Soteriology)"
  ],
  "dependencies": [
    "ISO-008"
  ],
  "negative_guards": [
    "Workbook ISO level is not automatic canon promotion.",
    "Do not label as C5 formal isomorphism without explicit preservation proof.",
    "Do not use as Lean proof unless the cited Lean file and theorem compile in the current package context.",
    "Weakest link: No moral metric tensor; not testable"
  ],
  "kill_conditions": [
    "Mapping fails structural-preservation review.",
    "A rival explanation preserves the same features with fewer assumptions.",
    "A claimed Lean theorem cannot be located or compiled in current context.",
    "Test C: Constraint fails in source evaluation.",
    "Test D: Bidirectional fails in source evaluation.",
    "Weakest link remains unresolved: No moral metric tensor; not testable"
  ],
  "proof_label": "ISOMORPHIC_EVENT_CANDIDATE",
  "current_status": "active_candidate",
  "rerun_status": "not_applicable",
  "source_artifacts": [
    "\\\\192.168.2.50\\h_hp\\Desktop\\Master EXCEL\\Isomorphic_Updated.xlsx",
    "D:\\GitHub\\Faith-through-physics-atoms\\_runtime\\Isomorphic_Updated.source-copy.xlsx"
  ],
  "ledger": [
    {
      "event_type": "isomorphic_workbook_imported",
      "lane": "IsomorphicEvents",
      "result": "recorded",
      "artifact_path": "\\\\192.168.2.50\\h_hp\\Desktop\\Master EXCEL\\Isomorphic_Updated.xlsx",
      "meaning": "Imported ISO-008 from Isomorphic_Updated.xlsx as an isomorphic-event candidate.",
      "limits": "Workbook level is preserved as source classification, not automatic formal isomorphism or canon proof.",
      "reviewer": "Codex",
      "timestamp": "2026-07-28T19:21:29+00:00",
      "event_id": "sha256:8e21db8b1ff7f0fa2df912bf261c5efe089709e5ba38fce6a34f7379a1b8b993"
    }
  ],
  "source_claim_id": "ISO:ISO-008"
}
