{
  "atom_id": "tp:lane4/crown-canon/crown-truth-series-001",
  "atom_uid": "sha256:a826ded73cb4a48b9cbf000c7fc9c8cda09a09cf8a1ffca7d8e733411b0bf536",
  "title": "The Truth Series Crown Packet",
  "claim": "The Truth Series argues that truth is ontological: stable truth-bearing correspondence is not one feature inside reality but a precondition for intelligible science, accountable morality, fruitful work, law-stability, and organized agency. The series dissolves the is-ought gap by treating moral ought as time-indexed misalignment before consequence, shows that removing mathematics undermines accountability, shows that removing law-stability undermines fruitfulness, and argues that evil parasitizes truth rather than forming an independent foundation.",
  "domain": "crown-canon",
  "lane": "CrownCanon",
  "claim_class": "crown_source_packet",
  "mode_classification": "CONSILIENCE_CANDIDATE",
  "assumptions": [
    "Truth-bearing correspondence is required for comparison, measurement, accountability, and repair.",
    "Stable mathematical and physical law structures are preconditions for science, work, stewardship, and fruitfulness.",
    "Evil systems require local truth, order, identity, communication, and reliable relation to operate.",
    "Moral agency arises when an agent can knowingly preserve or violate truth-bearing relation."
  ],
  "definitions": [
    "Structural morality: a system requires truth to remain coherent.",
    "Agent morality: a person knowingly preserves or violates truth-bearing relation.",
    "Truth as tool: truth used instrumentally, subordinated to an end it may not judge.",
    "Truth as standard: truth is terminal; the whole operation answers to it, including the top.",
    "Truth Series definition: morality begins wherever truth becomes necessary for right relation."
  ],
  "equations": [
    "ought(a, phi, t) := misaligned(state(a,t), phi) and consequences not yet arrived",
    "remove stable mathematics -> remove reliable comparison -> undermine accountability",
    "remove stable laws -> remove reliable cause/effect -> remove work -> remove fruitfulness",
    "universal destruction -> self-annihilation",
    "selective destruction -> contradiction and self-exemption"
  ],
  "bridges": [
    "truth ontology -> is-ought dissolution",
    "mathematics -> accountability support",
    "law-stability -> fruitfulness support",
    "evil as parasitic on truth -> borrowed-goodness bridge",
    "truth as Logos -> theological conditional bridge"
  ],
  "dependencies": [
    "tp:lane4/logos/logos-god-terminal-ground-001",
    "tp:lane4/logos/logos-math-logic-no-drift-001",
    "tp:lane4/consilience/consilience-good-bad-coherence-001",
    "tp:lane4/isomorphic-events/iso-deployed-math-light-judgment-001"
  ],
  "negative_guards": [
    "Do not cite the whole series as Lean proof.",
    "Do not cite the simulation as a measurement of the actual universe.",
    "Do not claim math proves morality without the structural/agent morality distinction.",
    "Do not promote the Logos conclusion beyond theological conditional until the Christian Logos bundle is tested.",
    "Do not let persuasive public language outrun the ledger labels."
  ],
  "kill_conditions": [
    "A stable possible world is shown where truth-bearing correspondence fails but science, accountability, repair, and fruitfulness remain intelligible.",
    "A moral ought is found with no present structural basis or truth relation.",
    "A regime of total falsehood can communicate, coordinate, and persist without borrowing truth.",
    "The simulation assumptions are shown to be irrelevant to the structural argument they are meant to demonstrate.",
    "A rival model explains truth, science, accountability, law-stability, evil parasitism, and fruitfulness with fewer unresolved commitments."
  ],
  "proof_label": "BRIDGE_DECLARED",
  "current_status": "active_candidate",
  "rerun_status": "not_applicable",
  "source_artifacts": [
    "C:\\theophysics\\CROWN_CORE\\02_CROWN_CANON\\THE_SERIES\\00_INDEX.md",
    "C:\\theophysics\\CROWN_CORE\\02_CROWN_CANON\\THE_SERIES\\PART_1_THE_IS_OUGHT_DISSOLUTION.md",
    "C:\\theophysics\\CROWN_CORE\\02_CROWN_CANON\\THE_SERIES\\PART_2_REMOVE_THE_MATH.md",
    "C:\\theophysics\\CROWN_CORE\\02_CROWN_CANON\\THE_SERIES\\PART_3_REMOVE_THE_LAWS.md",
    "C:\\theophysics\\CROWN_CORE\\02_CROWN_CANON\\THE_SERIES\\PART_4_THE_WORST_REGIME.md",
    "C:\\theophysics\\CROWN_CORE\\02_CROWN_CANON\\THE_SERIES\\PART_5_THE_DEFINITION.md",
    "C:\\theophysics\\CROWN_CORE\\02_CROWN_CANON\\THE_SERIES\\SIMULATION_RESULTS.md",
    "C:\\theophysics\\CROWN_CORE\\02_CROWN_CANON\\THE_SERIES\\truth_series_simulation.py",
    "C:\\theophysics\\CROWN_CORE\\02_CROWN_CANON\\THE_SERIES\\truth_series_simulation.png",
    "C:\\theophysics\\CROWN_CORE\\02_CROWN_CANON\\THE_SERIES\\_SOURCE_ATOXOR_STRESS_TEST.md"
  ],
  "ledger": [
    {
      "event_type": "claim_ingested",
      "result": "recorded",
      "artifact_path": "D:\\GitHub\\Faith-through-physics-atoms\\_runtime\\truth_series_crown_packet_candidate.json",
      "meaning": "Source claim ingested into Lane 4 ledger.",
      "limits": "Ingestion is not proof.",
      "timestamp": "2026-07-28T20:43:46+00:00",
      "lane": "CrownCanon",
      "event_id": "sha256:aed77d3db1993913dbc10d33cd340ea21be47dfc7e2e5511135dcc82eb4fb241"
    }
  ],
  "source_claim_id": "CROWN:TRUTH-SERIES-001"
}
