{
  "atom_id": "tp:lane4/axioms/ax-part1-fw-extended-108-e14-1-modified-friedmann-equation",
  "atom_uid": "sha256:16a4848fe89f5c2c5cd72b7d6dfe21aa69356e72876b0eb52154ba56c65e216d",
  "title": "E14.1 — Modified Friedmann Equation",
  "claim": "E14.1 — Modified Friedmann Equation is classified in Part 1 as FW_EXTENDED with decision MOVE_OUT_OF_STRICT_CORE and anchor BC6 (Infinite Energy Source).",
  "domain": "axioms",
  "lane": "Classification",
  "claim_class": "classification",
  "mode_classification": "FW_EXTENDED",
  "assumptions": [
    "BC6 (Infinite Energy Source)"
  ],
  "definitions": [],
  "equations": [],
  "bridges": [],
  "dependencies": [
    "BC6 (Infinite Energy Source)"
  ],
  "negative_guards": [
    "Mode classification is not proof.",
    "Do not encode every Part 1 row as a Lean axiom.",
    "Lean status must be checked separately from registry status."
  ],
  "kill_conditions": [
    "A later canonical dashboard contradicts this mode classification.",
    "A clean dependency audit changes the anchor status."
  ],
  "proof_label": "NOT_ESTABLISHED",
  "current_status": "active_candidate",
  "rerun_status": "not_applicable",
  "source_artifacts": [
    "O:\\_Theophysics_v5\\00_AXIOMS\\_LOSSLESS_SUMMARY\\AXIOMS_PART1_MODE_CLASSIFICATION.md"
  ],
  "ledger": [
    {
      "event_type": "classification_imported",
      "lane": "Classification",
      "result": "recorded",
      "artifact_path": "O:\\_Theophysics_v5\\00_AXIOMS\\_LOSSLESS_SUMMARY\\AXIOMS_PART1_MODE_CLASSIFICATION.md",
      "meaning": "Imported Part 1 mode classification row ['- 108_E14.1_Modified-Friedmann-Equation as FW_EXTENDED.",
      "limits": "Classification import is not proof and does not promote the claim to canon.",
      "reviewer": "Codex",
      "timestamp": "2026-07-28T19:10:19+00:00",
      "event_id": "sha256:ac68b2b636c00596aee7f14747beffeaefba64710220a5cfee36e20eb324339e"
    }
  ],
  "source_claim_id": "AX_PART1:FW_EXTENDED:['- 108_E14.1_Modified-Friedmann-Equation"
}
