{
  "atom_id": "tp:lane4/axioms/ax-part1-fw-extended-ln1-1",
  "atom_uid": "sha256:8ccab12590bcf8e91f4192b9f008234af56e061c1da0bd1f20d5f258e5baaca7",
  "title": "LN1.1 — Matter-Energy Derivative",
  "claim": "LN1.1 — Matter-Energy Derivative is classified in Part 1 as FW_EXTENDED with decision MOVE_OUT_OF_STRICT_CORE and anchor A1.1 (Existence), A1.2 (Distinction).",
  "domain": "axioms",
  "lane": "Classification",
  "claim_class": "classification",
  "mode_classification": "FW_EXTENDED",
  "assumptions": [
    "A1.1 (Existence)",
    "A1.2 (Distinction)"
  ],
  "definitions": [],
  "equations": [],
  "bridges": [],
  "dependencies": [
    "A1.1 (Existence)",
    "A1.2 (Distinction)"
  ],
  "negative_guards": [
    "Mode classification is not proof.",
    "Do not encode every Part 1 row as a Lean axiom.",
    "Lean status must be checked separately from registry status."
  ],
  "kill_conditions": [
    "A later canonical dashboard contradicts this mode classification.",
    "A clean dependency audit changes the anchor status."
  ],
  "proof_label": "NOT_ESTABLISHED",
  "current_status": "active_candidate",
  "rerun_status": "not_applicable",
  "source_artifacts": [
    "O:\\_Theophysics_v5\\00_AXIOMS\\_LOSSLESS_SUMMARY\\AXIOMS_PART1_MODE_CLASSIFICATION.md"
  ],
  "ledger": [
    {
      "event_type": "classification_imported",
      "lane": "Classification",
      "result": "recorded",
      "artifact_path": "O:\\_Theophysics_v5\\00_AXIOMS\\_LOSSLESS_SUMMARY\\AXIOMS_PART1_MODE_CLASSIFICATION.md",
      "meaning": "Imported Part 1 mode classification row LN1.1 as FW_EXTENDED.",
      "limits": "Classification import is not proof and does not promote the claim to canon.",
      "reviewer": "Codex",
      "timestamp": "2026-07-28T19:10:19+00:00",
      "event_id": "sha256:ce99c5a502b24632bcfa329bbaadac89f81f95888d4ab5071203ae20403cc3b1"
    }
  ],
  "source_claim_id": "AX_PART1:FW_EXTENDED:LN1.1"
}
