{
  "atom_id": "tp:lane4/axioms/ax-part1-ax-scaffold-d4-2",
  "atom_uid": "sha256:796bb86d8f2bc4d58154d94e3637df216a2de6b2e534d45113e2c06947464fb3",
  "title": "D4.2 — Compression Ratio",
  "claim": "D4.2 — Compression Ratio is classified in Part 1 as AX_SCAFFOLD with decision KEEP and anchor A2.2 (Self-Grounding).",
  "domain": "axioms",
  "lane": "Classification",
  "claim_class": "classification",
  "mode_classification": "AX_SCAFFOLD",
  "assumptions": [
    "A2.2 (Self-Grounding)"
  ],
  "definitions": [],
  "equations": [],
  "bridges": [],
  "dependencies": [
    "A2.2 (Self-Grounding)"
  ],
  "negative_guards": [
    "Mode classification is not proof.",
    "Do not encode every Part 1 row as a Lean axiom.",
    "Lean status must be checked separately from registry status."
  ],
  "kill_conditions": [
    "A later canonical dashboard contradicts this mode classification.",
    "A clean dependency audit changes the anchor status."
  ],
  "proof_label": "NOT_ESTABLISHED",
  "current_status": "active_candidate",
  "rerun_status": "not_applicable",
  "source_artifacts": [
    "O:\\_Theophysics_v5\\00_AXIOMS\\_LOSSLESS_SUMMARY\\AXIOMS_PART1_MODE_CLASSIFICATION.md"
  ],
  "ledger": [
    {
      "event_type": "classification_imported",
      "lane": "Classification",
      "result": "recorded",
      "artifact_path": "O:\\_Theophysics_v5\\00_AXIOMS\\_LOSSLESS_SUMMARY\\AXIOMS_PART1_MODE_CLASSIFICATION.md",
      "meaning": "Imported Part 1 mode classification row D4.2 as AX_SCAFFOLD.",
      "limits": "Classification import is not proof and does not promote the claim to canon.",
      "reviewer": "Codex",
      "timestamp": "2026-07-28T19:10:19+00:00",
      "event_id": "sha256:f176d0d2f4c65d54b34f37363378526c4f3dd9baa9f486dc05b4091516e50a56"
    }
  ],
  "source_claim_id": "AX_PART1:AX_SCAFFOLD:D4.2"
}
