{
  "atom_id": "tp:lane4/axioms/ax-part1-ax-core-a1-1",
  "atom_uid": "sha256:cdf241a3251c14db26df0b5e1bc5447661d843af4785682b29c4ca82d331a0d0",
  "title": "A1.1 — Existence",
  "claim": "A1.1 — Existence is classified in Part 1 as AX_CORE with decision KEEP and anchor A1.1 (Existence).",
  "domain": "axioms",
  "lane": "Classification",
  "claim_class": "classification",
  "mode_classification": "AX_CORE",
  "assumptions": [
    "A1.1 (Existence)"
  ],
  "definitions": [],
  "equations": [],
  "bridges": [],
  "dependencies": [
    "A1.1 (Existence)"
  ],
  "negative_guards": [
    "Mode classification is not proof.",
    "Do not encode every Part 1 row as a Lean axiom.",
    "Lean status must be checked separately from registry status."
  ],
  "kill_conditions": [
    "A later canonical dashboard contradicts this mode classification.",
    "A clean dependency audit changes the anchor status."
  ],
  "proof_label": "NOT_ESTABLISHED",
  "current_status": "active_candidate",
  "rerun_status": "not_applicable",
  "source_artifacts": [
    "O:\\_Theophysics_v5\\00_AXIOMS\\_LOSSLESS_SUMMARY\\AXIOMS_PART1_MODE_CLASSIFICATION.md"
  ],
  "ledger": [
    {
      "event_type": "classification_imported",
      "lane": "Classification",
      "result": "recorded",
      "artifact_path": "O:\\_Theophysics_v5\\00_AXIOMS\\_LOSSLESS_SUMMARY\\AXIOMS_PART1_MODE_CLASSIFICATION.md",
      "meaning": "Imported Part 1 mode classification row A1.1 as AX_CORE.",
      "limits": "Classification import is not proof and does not promote the claim to canon.",
      "reviewer": "Codex",
      "timestamp": "2026-07-28T19:10:19+00:00",
      "event_id": "sha256:d951f6141091e33bf4a9a51c24a868a9fcb45bc7d40c51afb642be48a48e5daa"
    }
  ],
  "source_claim_id": "AX_PART1:AX_CORE:A1.1"
}
