{
  "atom_id": "tp:lane4/isomorphic-events/iso-iso-038",
  "atom_uid": "sha256:3f33c7994bc066cadc2b4f8eb84c12c97f6085239891b9425cbca6c8900bafcb",
  "title": "ISO-038 - Fruits of the Spirit (Love Derivatives)",
  "claim": "ISO-038: Fruits of the Spirit (Love Derivatives) maps QCD / Strong Force (Yukawa) to Pneumatology (Galatians 5:22-23). Workbook verdict: Level 3. Honest verdict: Nine modes derived from parent equation equilibrium. Lean proves distinctness + love non-negotiable.",
  "domain": "isomorphic-events",
  "lane": "IsomorphicEvents",
  "claim_class": "isomorphic_event",
  "mode_classification": "C3_REVIEW_HOMOMORPHISM_OR_ISOMORPHISM_CANDIDATE",
  "assumptions": [
    "QCD / Strong Force (Yukawa)",
    "Pneumatology (Galatians 5:22-23)",
    "AAA classification workbook accepted as source classification, not proof"
  ],
  "definitions": [
    "Lean verified: gate_true/false, 9 distinct modes from equilibrium",
    "Nine modes derived from parent equation equilibrium. Lean proves distinctness + love non-negotiable."
  ],
  "equations": [],
  "bridges": [
    "QCD / Strong Force (Yukawa) -> Pneumatology (Galatians 5:22-23)"
  ],
  "dependencies": [
    "ISO-038"
  ],
  "negative_guards": [
    "Workbook ISO level is not automatic canon promotion.",
    "Do not label as C5 formal isomorphism without explicit preservation proof.",
    "Do not use as Lean proof unless the cited Lean file and theorem compile in the current package context.",
    "Weakest link: Quantitative coupling constants unmeasured"
  ],
  "kill_conditions": [
    "Mapping fails structural-preservation review.",
    "A rival explanation preserves the same features with fewer assumptions.",
    "A claimed Lean theorem cannot be located or compiled in current context.",
    "Weakest link remains unresolved: Quantitative coupling constants unmeasured"
  ],
  "proof_label": "ISOMORPHIC_EVENT_CANDIDATE",
  "current_status": "active_candidate",
  "rerun_status": "not_applicable",
  "source_artifacts": [
    "\\\\192.168.2.50\\h_hp\\Desktop\\Master EXCEL\\Isomorphic_Updated.xlsx",
    "D:\\GitHub\\Faith-through-physics-atoms\\_runtime\\Isomorphic_Updated.source-copy.xlsx"
  ],
  "ledger": [
    {
      "event_type": "isomorphic_workbook_imported",
      "lane": "IsomorphicEvents",
      "result": "recorded",
      "artifact_path": "\\\\192.168.2.50\\h_hp\\Desktop\\Master EXCEL\\Isomorphic_Updated.xlsx",
      "meaning": "Imported ISO-038 from Isomorphic_Updated.xlsx as an isomorphic-event candidate.",
      "limits": "Workbook level is preserved as source classification, not automatic formal isomorphism or canon proof.",
      "reviewer": "Codex",
      "timestamp": "2026-07-28T19:21:29+00:00",
      "event_id": "sha256:2427825c1e1363d9be0d1d4755dfb39dedfeb1697639a69e36ee737df5ca2f80"
    }
  ],
  "source_claim_id": "ISO:ISO-038"
}
