{
  "atom_id": "tp:lane4/axioms/ax-part1-hy-evidence-prot18-5",
  "atom_uid": "sha256:4f7f9a1ea244a6ec71388611cf5706fb8c846fc921a0e5f183379e7c1de3ddcb",
  "title": "PROT18.5 — Phi-Virtue Correlation Study",
  "claim": "PROT18.5 — Phi-Virtue Correlation Study is classified in Part 1 as HY_EVIDENCE with decision MOVE_OUT_OF_STRICT_CORE and anchor UNANCHORED_IN_CURRENT_CHAIN.",
  "domain": "axioms",
  "lane": "Classification",
  "claim_class": "classification",
  "mode_classification": "HY_EVIDENCE",
  "assumptions": [
    "UNANCHORED_IN_CURRENT_CHAIN"
  ],
  "definitions": [],
  "equations": [],
  "bridges": [],
  "dependencies": [
    "UNANCHORED_IN_CURRENT_CHAIN"
  ],
  "negative_guards": [
    "Mode classification is not proof.",
    "Do not encode every Part 1 row as a Lean axiom.",
    "Lean status must be checked separately from registry status.",
    "Unanchored entry cannot be treated as bedrock until a clean dependency path is supplied."
  ],
  "kill_conditions": [
    "A later canonical dashboard contradicts this mode classification.",
    "A clean dependency audit changes the anchor status."
  ],
  "proof_label": "NOT_ESTABLISHED",
  "current_status": "active_candidate_unanchored",
  "rerun_status": "not_applicable",
  "source_artifacts": [
    "O:\\_Theophysics_v5\\00_AXIOMS\\_LOSSLESS_SUMMARY\\AXIOMS_PART1_MODE_CLASSIFICATION.md"
  ],
  "ledger": [
    {
      "event_type": "classification_imported",
      "lane": "Classification",
      "result": "recorded",
      "artifact_path": "O:\\_Theophysics_v5\\00_AXIOMS\\_LOSSLESS_SUMMARY\\AXIOMS_PART1_MODE_CLASSIFICATION.md",
      "meaning": "Imported Part 1 mode classification row PROT18.5 as HY_EVIDENCE.",
      "limits": "Classification import is not proof and does not promote the claim to canon.",
      "reviewer": "Codex",
      "timestamp": "2026-07-28T19:10:19+00:00",
      "event_id": "sha256:9758903bb132fe5513c9262ea004cfce085aee0bddf491b7d27a238f58873e30"
    }
  ],
  "source_claim_id": "AX_PART1:HY_EVIDENCE:PROT18.5"
}
