{
  "atom_id": "tp:lane4/axioms/ax-part1-fw-extended-a7-1",
  "atom_uid": "sha256:1726806e540336a0761cf6ba4af1a7175f0cfee982f6b28e0d6f9a31bca95158",
  "title": "A7.1 — Closure Requirement",
  "claim": "A7.1 — Closure Requirement is classified in Part 1 as FW_EXTENDED with decision MOVE_OUT_OF_STRICT_CORE and anchor UNANCHORED_IN_CURRENT_CHAIN.",
  "domain": "axioms",
  "lane": "Classification",
  "claim_class": "classification",
  "mode_classification": "FW_EXTENDED",
  "assumptions": [
    "UNANCHORED_IN_CURRENT_CHAIN"
  ],
  "definitions": [],
  "equations": [],
  "bridges": [],
  "dependencies": [
    "UNANCHORED_IN_CURRENT_CHAIN"
  ],
  "negative_guards": [
    "Mode classification is not proof.",
    "Do not encode every Part 1 row as a Lean axiom.",
    "Lean status must be checked separately from registry status.",
    "Unanchored entry cannot be treated as bedrock until a clean dependency path is supplied."
  ],
  "kill_conditions": [
    "A later canonical dashboard contradicts this mode classification.",
    "A clean dependency audit changes the anchor status."
  ],
  "proof_label": "NOT_ESTABLISHED",
  "current_status": "active_candidate_unanchored",
  "rerun_status": "not_applicable",
  "source_artifacts": [
    "O:\\_Theophysics_v5\\00_AXIOMS\\_LOSSLESS_SUMMARY\\AXIOMS_PART1_MODE_CLASSIFICATION.md"
  ],
  "ledger": [
    {
      "event_type": "classification_imported",
      "lane": "Classification",
      "result": "recorded",
      "artifact_path": "O:\\_Theophysics_v5\\00_AXIOMS\\_LOSSLESS_SUMMARY\\AXIOMS_PART1_MODE_CLASSIFICATION.md",
      "meaning": "Imported Part 1 mode classification row A7.1 as FW_EXTENDED.",
      "limits": "Classification import is not proof and does not promote the claim to canon.",
      "reviewer": "Codex",
      "timestamp": "2026-07-28T19:10:19+00:00",
      "event_id": "sha256:0bb37fb6c4a02e61acb3ae248104d10f5397329872160e09486bdca3b5f5f529"
    }
  ],
  "source_claim_id": "AX_PART1:FW_EXTENDED:A7.1"
}
