{
  "atom_id": "tp:lane4/isomorphic-events/iso-iso-025",
  "atom_uid": "sha256:2101d2a1d93b4c1642ce41ec45dd97cd454b4a22b0925663e07d4063dee68259",
  "title": "ISO-025 - Immunology ↔ Soteriology",
  "claim": "ISO-025: Immunology ↔ Soteriology maps Immunology to Soteriology / Sanctification. Workbook verdict: Level 3. Honest verdict: Full doc confirms. Swap passed. ROC genuinely preserved.",
  "domain": "isomorphic-events",
  "lane": "IsomorphicEvents",
  "claim_class": "isomorphic_event",
  "mode_classification": "C3_REVIEW_HOMOMORPHISM_OR_ISOMORPHISM_CANDIDATE",
  "assumptions": [
    "Immunology",
    "Soteriology / Sanctification",
    "AAA classification workbook accepted as source classification, not proof"
  ],
  "definitions": [
    "Swap PASSED. 10 correspondences. ROC preserved.",
    "Full doc confirms. Swap passed. ROC genuinely preserved."
  ],
  "equations": [],
  "bridges": [
    "Immunology -> Soteriology / Sanctification"
  ],
  "dependencies": [
    "ISO-025"
  ],
  "negative_guards": [
    "Workbook ISO level is not automatic canon promotion.",
    "Do not label as C5 formal isomorphism without explicit preservation proof.",
    "Do not use as Lean proof unless the cited Lean file and theorem compile in the current package context.",
    "Weakest link: Operational definitions still needed"
  ],
  "kill_conditions": [
    "Mapping fails structural-preservation review.",
    "A rival explanation preserves the same features with fewer assumptions.",
    "A claimed Lean theorem cannot be located or compiled in current context.",
    "Weakest link remains unresolved: Operational definitions still needed"
  ],
  "proof_label": "ISOMORPHIC_EVENT_CANDIDATE",
  "current_status": "active_candidate",
  "rerun_status": "not_applicable",
  "source_artifacts": [
    "\\\\192.168.2.50\\h_hp\\Desktop\\Master EXCEL\\Isomorphic_Updated.xlsx",
    "D:\\GitHub\\Faith-through-physics-atoms\\_runtime\\Isomorphic_Updated.source-copy.xlsx"
  ],
  "ledger": [
    {
      "event_type": "isomorphic_workbook_imported",
      "lane": "IsomorphicEvents",
      "result": "recorded",
      "artifact_path": "\\\\192.168.2.50\\h_hp\\Desktop\\Master EXCEL\\Isomorphic_Updated.xlsx",
      "meaning": "Imported ISO-025 from Isomorphic_Updated.xlsx as an isomorphic-event candidate.",
      "limits": "Workbook level is preserved as source classification, not automatic formal isomorphism or canon proof.",
      "reviewer": "Codex",
      "timestamp": "2026-07-28T19:21:29+00:00",
      "event_id": "sha256:c4256bd0921b985913a122b2bc0a25dbf3d9402c4914bf72fbdc07dd4c261f01"
    }
  ],
  "source_claim_id": "ISO:ISO-025"
}
