{
  "atom_id": "tp:lane4/isomorphic-events/iso-iso-000",
  "atom_uid": "sha256:d309bfc7a4ae653222c4530898b05b66ca1b4d8b58a88d7ccfe49af72342879d",
  "title": "ISO-000 - 24-Property Structural Identity",
  "claim": "ISO-000: 24-Property Structural Identity maps Mathematics / Morality to Classical Theism (God). Workbook verdict: Level 3. Honest verdict: 24-property table survives swap. No row broken.",
  "domain": "isomorphic-events",
  "lane": "IsomorphicEvents",
  "claim_class": "isomorphic_event",
  "mode_classification": "C4_REVIEW_IDENTITY_CANDIDATE",
  "assumptions": [
    "Mathematics / Morality",
    "Classical Theism (God)",
    "AAA classification workbook accepted as source classification, not proof"
  ],
  "definitions": [
    "Swap passes all 24 rows; Kolmogorov 24:1",
    "24-property table survives swap. No row broken."
  ],
  "equations": [],
  "bridges": [
    "Mathematics / Morality -> Classical Theism (God)"
  ],
  "dependencies": [
    "ISO-000"
  ],
  "negative_guards": [
    "Workbook ISO level is not automatic canon promotion.",
    "Do not label as C5 formal isomorphism without explicit preservation proof.",
    "Do not use as Lean proof unless the cited Lean file and theorem compile in the current package context.",
    "Weakest link: Property #14 contested; identity vs isomorphism gap",
    "Promotion blocker: Must show 24 shared properties flow from SINGLE generative source (not just co-extensive)",
    "Promotion blocker: Property #14 (Good) — 'info theory has built-in oughts' remains contested",
    "Promotion blocker: Need operational definitions to cross into Level 4"
  ],
  "kill_conditions": [
    "Mapping fails structural-preservation review.",
    "A rival explanation preserves the same features with fewer assumptions.",
    "A claimed Lean theorem cannot be located or compiled in current context.",
    "Weakest link remains unresolved: Property #14 contested; identity vs isomorphism gap"
  ],
  "proof_label": "ISOMORPHIC_EVENT_CANDIDATE",
  "current_status": "active_candidate",
  "rerun_status": "not_applicable",
  "source_artifacts": [
    "\\\\192.168.2.50\\h_hp\\Desktop\\Master EXCEL\\Isomorphic_Updated.xlsx",
    "D:\\GitHub\\Faith-through-physics-atoms\\_runtime\\Isomorphic_Updated.source-copy.xlsx"
  ],
  "ledger": [
    {
      "event_type": "isomorphic_workbook_imported",
      "lane": "IsomorphicEvents",
      "result": "recorded",
      "artifact_path": "\\\\192.168.2.50\\h_hp\\Desktop\\Master EXCEL\\Isomorphic_Updated.xlsx",
      "meaning": "Imported ISO-000 from Isomorphic_Updated.xlsx as an isomorphic-event candidate.",
      "limits": "Workbook level is preserved as source classification, not automatic formal isomorphism or canon proof.",
      "reviewer": "Codex",
      "timestamp": "2026-07-28T19:21:29+00:00",
      "event_id": "sha256:37e962523b74ff1bbb6817889109faea5735f9ea82165dbd596b2c10d03b02fd"
    }
  ],
  "source_claim_id": "ISO:ISO-000"
}
