{
  "atom_id": "tp:lane4/axioms/ax-part1-ax-scaffold-d19-5",
  "atom_uid": "sha256:8b354b30817c91f9e9f4aa389915337589a74677f12464afd56099b9579d0673",
  "title": "D19.5 — Law V Definition (Conservation Symmetry)",
  "claim": "D19.5 — Law V Definition (Conservation Symmetry) is classified in Part 1 as AX_SCAFFOLD with decision KEEP and anchor UNANCHORED_IN_CURRENT_CHAIN.",
  "domain": "axioms",
  "lane": "Classification",
  "claim_class": "classification",
  "mode_classification": "AX_SCAFFOLD",
  "assumptions": [
    "UNANCHORED_IN_CURRENT_CHAIN"
  ],
  "definitions": [],
  "equations": [],
  "bridges": [],
  "dependencies": [
    "UNANCHORED_IN_CURRENT_CHAIN"
  ],
  "negative_guards": [
    "Mode classification is not proof.",
    "Do not encode every Part 1 row as a Lean axiom.",
    "Lean status must be checked separately from registry status.",
    "Unanchored entry cannot be treated as bedrock until a clean dependency path is supplied."
  ],
  "kill_conditions": [
    "A later canonical dashboard contradicts this mode classification.",
    "A clean dependency audit changes the anchor status."
  ],
  "proof_label": "NOT_ESTABLISHED",
  "current_status": "active_candidate_unanchored",
  "rerun_status": "not_applicable",
  "source_artifacts": [
    "O:\\_Theophysics_v5\\00_AXIOMS\\_LOSSLESS_SUMMARY\\AXIOMS_PART1_MODE_CLASSIFICATION.md"
  ],
  "ledger": [
    {
      "event_type": "classification_imported",
      "lane": "Classification",
      "result": "recorded",
      "artifact_path": "O:\\_Theophysics_v5\\00_AXIOMS\\_LOSSLESS_SUMMARY\\AXIOMS_PART1_MODE_CLASSIFICATION.md",
      "meaning": "Imported Part 1 mode classification row D19.5 as AX_SCAFFOLD.",
      "limits": "Classification import is not proof and does not promote the claim to canon.",
      "reviewer": "Codex",
      "timestamp": "2026-07-28T19:10:19+00:00",
      "event_id": "sha256:98c57bca3dec7870c018202882127432882239da75d9d72ad592e54926bbd17c"
    }
  ],
  "source_claim_id": "AX_PART1:AX_SCAFFOLD:D19.5"
}
