{
  "atom_id": "tp:lane4/axioms/ax-part1-fw-extended-t4-1",
  "atom_uid": "sha256:37703ef2336f5f46583d770c8d0909df1c2719578bf7b2ffc77c9d0cdb483d4e",
  "title": "T4.1 — Laws Are Low-K Descriptions",
  "claim": "T4.1 — Laws Are Low-K Descriptions is classified in Part 1 as FW_EXTENDED with decision MOVE_OUT_OF_STRICT_CORE and anchor A2.2 (Self-Grounding).",
  "domain": "axioms",
  "lane": "Classification",
  "claim_class": "classification",
  "mode_classification": "FW_EXTENDED",
  "assumptions": [
    "A2.2 (Self-Grounding)"
  ],
  "definitions": [],
  "equations": [],
  "bridges": [],
  "dependencies": [
    "A2.2 (Self-Grounding)"
  ],
  "negative_guards": [
    "Mode classification is not proof.",
    "Do not encode every Part 1 row as a Lean axiom.",
    "Lean status must be checked separately from registry status."
  ],
  "kill_conditions": [
    "A later canonical dashboard contradicts this mode classification.",
    "A clean dependency audit changes the anchor status."
  ],
  "proof_label": "NOT_ESTABLISHED",
  "current_status": "active_candidate",
  "rerun_status": "not_applicable",
  "source_artifacts": [
    "O:\\_Theophysics_v5\\00_AXIOMS\\_LOSSLESS_SUMMARY\\AXIOMS_PART1_MODE_CLASSIFICATION.md"
  ],
  "ledger": [
    {
      "event_type": "classification_imported",
      "lane": "Classification",
      "result": "recorded",
      "artifact_path": "O:\\_Theophysics_v5\\00_AXIOMS\\_LOSSLESS_SUMMARY\\AXIOMS_PART1_MODE_CLASSIFICATION.md",
      "meaning": "Imported Part 1 mode classification row T4.1 as FW_EXTENDED.",
      "limits": "Classification import is not proof and does not promote the claim to canon.",
      "reviewer": "Codex",
      "timestamp": "2026-07-28T19:10:19+00:00",
      "event_id": "sha256:d2bf91121ba143417e339fa9fb995986f8f3276900d426b8bd7d746a8d165223"
    }
  ],
  "source_claim_id": "AX_PART1:FW_EXTENDED:T4.1"
}
